{
  "eventId": "6b1f3a52-7d0e-4a8e-9f61-2b8d7c1e0a11",
  "eventType": "vision.analysis.requested",
  "version": 1,
  "occurredAt": "2026-10-11T12:00:00.000Z",
  "data": {
    "analysisId": "0d5e8f8a-1b7c-4f0e-8a51-3c9d2e7b6a40",
    "tenantId": "a3c9e2d1-5f4b-4e6a-9c8d-7b1a0f2e3d45",
    "service": "PPE_COMPLIANCE",
    "image": {
      "storage": "local",
      "key": "a3c9e2d1-5f4b-4e6a-9c8d-7b1a0f2e3d45/0d5e8f8a-1b7c-4f0e-8a51-3c9d2e7b6a40.jpg",
      "contentType": "image/jpeg"
    },
    "options": { "confidenceThreshold": 0.35 }
  }
}
